title,abstract,date,doi,search_date
Identification of non-synonymous SNPs affecting structure and function of MLH1 and NBN proteins: a computational approach.,"The genes NBN and MLH1 are critical for DNA repair, and this study aimed to detect and predict the effects of pathogenic single nucleotide polymorphisms (SNPs) in their mRNA and protein sequences. An in silico analysis assessed the impact of SNPs on the physicochemical properties, structure, stability, and function of MLH1 and NBN proteins. Results revealed that some SNPs significantly alter protein stability, structure, and binding interactions, potentially impairing DNA repair. Molecular docking studies further indicated disruptions in protein-protein interactions due to specific SNPs. These findings underscore the importance of using in silico methods to predict the functional effects of genetic variations, providing insights that could guide personalized treatments and improve cancer detection.",2025-05-02,10.1007/s13353-025-00968-2,2025/05/01
An intranasal subunit vaccine induces protective systemic and mucosal antibody immunity against respiratory viruses in mouse models.,"Although vaccines are usually given intramuscularly, the intranasal delivery route may lead to better mucosal protection and limit the spread of respiratory virus while easing administration and improving vaccine acceptance. The challenge, however, is to achieve delivery across the selective epithelial cell barrier. Here we report on a subunit vaccine platform, in which the antigen is genetically fused to albumin to facilitate FcRn-mediated transport across the mucosal barrier in the presence of adjuvant. Intranasal delivery in conventional and transgenic mouse models induces both systemic and mucosal antigen-specific antibody responses that protect against challenge with SARS-CoV-2 or influenza A. When benchmarked against an intramuscularly administered mRNA vaccine or an intranasally administered antigen fused to an alternative carrier of similar size, only the albumin-based intranasal vaccine yields robust mucosal IgA antibody responses. Our results thus suggest that this needle-free, albumin-based vaccine platform may be suited for vaccination against respiratory pathogens.",2025-05-01,10.1038/s41467-025-59353-6,2025/05/01
Molecular structure and protein function of mitochondrial fusion protein Mfn2 alleviate Alzheimer's disease: exercise assisted regulation.,"Alzheimer's disease is a neurodegenerative disease that affects cognitive function. Recent studies have shown that mitochondrial dysfunction plays an important role in its pathological process. The mitochondrial fusion protein Mfn2 plays a crucial role in maintaining mitochondrial function and cellular health. The aim of this study is to explore the molecular structure of mitochondrial fusion protein Mfn2 and its role in Alzheimer's disease, combined with the effects of exercise assisted regulation, to evaluate its potential in alleviating symptoms. By constructing a brain model of Alzheimer's disease, conducting pathological analysis and molecular dynamics simulations, we aim to explore the relationship between the disease and mitochondrial function. Analyze the molecular structure of Mfn2, study its role in normal and pathological states, and evaluate its impact on Mfn2 and mitochondrial function through exercise intervention. The study demonstrated the typical pathological features of Alzheimer's disease and confirmed the relationship between mitochondrial dysfunction and disease progression. The structural analysis of mitochondrial fusion protein Mfn2 indicates its importance in promoting mitochondrial fusion. Exercise intervention significantly increased the expression of Mfn2 and improved mitochondrial function, further alleviating pathological changes associated with Alzheimer's disease.",2025-04-29,10.1016/j.ijbiomac.2025.143696,2025/05/01
Design of Recombinant Bacteriocin Fusion Protein and Evaluation of its Anticancer and Antibacterial Activity.,"Gastrointestinal cancer is the fifth most common cause of cancer in the world, and its treatment is currently challenging. Bacteriocins are cationic proteins that are produced by the ribosome. Many bacteriocins exhibit cytotoxicity against cancer cells and are attractive candidates for future research. In this study, the anticancer and antibacterial activity of a recombinant six bacteriocin fusion protein bifidocin, enterocin, nisin, thermophilin, epidermycin, and colicin (BENTEC) was investigated against the AGS cancer cell line and important gram-positive and gram-negative pathogens.",2025-04-29,10.1016/j.micpath.2025.107633,2025/05/01
Design of potent and proteolytically stable double biaryl-stapled GLP-1R/GIPR peptide dual agonists.,"The successful treatment of type 2 diabetes and obesity with tirzepatide highlights the dual agonists of glucagon-like peptide-1 receptor (GLP-1R) and glucose-dependent insulinotropic peptide receptor (GIPR) as a powerful new generation of anti-diabetic drugs. However, tirzepatide and other GLP-1R/GIPR dual agonists currently in clinical development are linear peptides susceptible to proteolytic cleavage, thus preventing their uses as oral drugs. Previously, we reported the design of the proteolytically stable GLP-1R/GIPR peptide dual agonists via sidechain biaryl stapling. Although the stapled peptides exhibit improved proteolytic stability, they are still not sufficiently stable for oral delivery. Here, we report on the design and synthesis of more stable GLP-1R/GIPR dual agonists through a combined use of double biaryl stapling and α-methylation. One of the double-stapled and α-methylated peptides, DA23-Bpy<sup>10,17</sup>Bpy<sup>21,28</sup>, showed more potent and balanced dual agonist activities than tirzepatide, a half-life of 30 min in simulated intestinal fluid, and equal glucose lowering activity compared to semaglutide in oral glucose tolerance test in rodents. These potent and proteolytically stable double biaryl-stapled analogs should provide valuable lead peptides for developing oral GLP-1R/GIPR dual agonist drugs to treat diabetes and obesity.",2025-04-26,10.1016/j.bmc.2025.118215,2025/05/01
Formation of tiger nut protein fibrils through self-assembly and different nuclei-induced pathways: Focus on structure and core peptide region.,"Tiger nut protein fibrils (TNPFs) were prepared through three pathways: self-assembly (TNPF), Homogeneous nuclei (HN)-induced (HN-TNPF), and Secondary nuclei (SN)-induced (SN-TNPF). Differences in morphology, structure, and formation mechanisms among the three TNPFs were examined. HN and SN, serving as fibrillation seeds, enhanced both fibril production and fibrillation rate. Compared to TNPF, the addition of HN and SN shortening the lag time from 3 (TNPF) to 2.2 (HN-TNPF) and 1.89 h (SN-TNPF), respectively. All three TNPFs exhibited fibril structures, notably, SN-TNPF displayed bifurcations on the trunk. Regarding secondary structure, a transition from α-helix to β-sheet was observed in all samples. The dynamic evolution of tertiary structure demonstrated that fibrillation was driven by non-covalent interactions and disulfide bond. After hydrolysis, the identification of specific peptides by LC-MS/MS and core region prediction using AMYLPRED2 showed 89.29 %, 82.22 %, and 89.74 % of peptide sequences in TNPF, HN-TNPF, and SN-TNPF, respectively, possessed fibril forming potential.",2025-04-28,10.1016/j.foodchem.2025.144557,2025/05/01
Dual-Site Targeting by Peptide Inhibitors of the N-Terminal Domain of Hsp90: Mechanism and Design.,"Heat shock protein 90 (Hsp90) is a pivotal molecular chaperone crucial in the maturation of client proteins, positioning it as a significant target for cancer therapy. However, the design of effective Hsp90 inhibitors presents substantial challenges due to the complex interaction network and the requisite specificity of the inhibitors. This study tackles the task of designing peptide inhibitors capable of concurrently binding to both the ATP-binding pocket and the Cdc37-binding site within the N-terminal domain of Hsp90. In response to these challenges, we developed an advanced peptide screening protocol that merges machine learning with various molecular simulation techniques to boost the identification and optimization of potent inhibitors. Our integrated approach employs a convolutional neural network-based framework to predict peptide binding propensities. This predictive model is augmented by comprehensive molecular docking and dynamic simulations to assess the stability and interaction dynamics of Hsp90/peptide complexes. We successfully identified three heptapeptides that demonstrate the ability to interact with both binding sites, effectively obstructing the entrance to the ATP-binding pocket. This study elucidates the inhibitory mechanisms of these peptides, paves the way for the development of more efficacious therapeutic agents targeting Hsp90, and underscores the value of integrating machine learning techniques with molecular modeling in the peptide design process.",2025-05-01,10.1021/acs.jcim.5c00629,2025/05/01
Predicted risk genotypes to cardiovascular diseases based on cholesterol ester transfer protein (CETP -rs708272) and lipoprotein lipase (LPL -rs13702) variants in worldwide populations: highest risk in populations with Native American ancestry.,"The human genetic variability mainly involves single nucleotide variants (SNVs) that determine the characteristics among individuals. Some gene variants related to the lipid metabolism have demonstrated their importance to generate susceptibility to some metabolic diseases, such as those in the Cholesterol Ester Transfer Protein (CETP) and Lipoprotein Lipase (LPL) genes.",2025-05-01,10.1007/s11033-025-10537-9,2025/05/01
A responsive living material prepared by diffusion reveals extracellular enzyme activity of cyanobacteria.,"Stimuli-responsive engineered living materials (ELMs) can respond to environmental or biochemical cues and have broad utility in biological sensors and machines, but have traditionally been limited to biocompatible scaffolds. This is because they are typically made by mixing cells into a precursor solution before crosslinking. Here, we demonstrate a diffusion mechanism for incorporating cells of the cyanobacterium <i>Synechococcus elongatus</i> sp. PCC 7942 (<i>S. elongatus</i>) into nanoclay-poly-N-isopropylacrylamide (NC-PNIPAm), a hydrogel with a cytotoxic precursor, by exploiting its temperature-dependent shape-morphing behavior. Subsequent growth of <i>S. elongatus</i> caused a decrease in the bending curvature and stiffness (local Young's modulus) of NC-PNIPAm due to partial degradation by an unannotated enzyme. Creation and observation of this cyanobacteria-hydrogel ELM showcases a method for diffusing cells into a hydrogel as well as characterizing an extracellular enzyme.",2025-05-01,10.1073/pnas.2424405122,2025/05/01
EVOLVE: A Web Platform for AI-Based Protein Mutation Prediction and Evolutionary Phase Exploration.,"While predicting structure-function relationships from sequence data is fundamental in biophysical chemistry, identifying prospective single-point and collective mutation sites in proteins can help us stay ahead in understanding their potential effects on protein structure and function. Addressing the challenges of large sequence-space analysis, we present EVOLVE, a web tool enabling researchers to explore prospective mutation sites and their collective behavior. EVOLVE integrates a statistical mechanics-guided machine learning algorithms to predict probable mutational sites, with statistical mechanics calculating mutational entropy to accurately identify mutational hotspots. Validation against a number of viral protein sequences confirms its ability to predict mutations and their functional consequences. By leveraging statistical mechanics of phase transition concept, EVOLVE also quantifies mutational entropy fluctuations, offering a quantitative foundation for identifying Variants of Concern (VOC) or Variants under Monitoring (VUM) as per World Health Organization (WHO) guidelines. EVOLVE streamlines data upload and analysis with a user-friendly interface and comprehensive tutorials. Access EVOLVE free at https://evolve-iiserkol.com.",2025-05-01,10.1021/acs.jcim.5c00026,2025/05/01
Prognostic value of serum C-reactive protein in idiopathic multicentric Castleman disease and construction of a prognostic model for patients.,"Idiopathic Multicentric Castleman disease (iMCD) is a type of the rare lymphoproliferative diseases. C-reactive protein (CRP) is a well-recognized biomarker of inflammation, frequently exhibits elevated levels in individuals diagnosed with iMCD. However, its prognostic value of this factor in iMCD remains uncertain.",2025-04-16,10.3389/fmed.2025.1544250,2025/05/01
Dr. Kinase: predicting the drug-resistance hotspots of protein kinases.,"Protein kinases (PKs) regulate various cellular functions, and are targeted by small-molecule kinase inhibitors (KIs) in cancers and other diseases. However, drug resistance (DR) of KIs occurs through critical mutations in four types of representative hotspots, including gatekeeper, G-loop, αC-helix, and A-loop. KI DR has become a common clinical complication affecting multiple cancers, targeted kinases, and drugs. To tackle this challenge, we report an upgraded web server, namely Dr. Kinase, for predicting the loci of four DR hotspots and assessing effects of mutations on DR hotspots for PKs in our previous studies, by utilizing multimodal features and deep hybrid learning. The performance of Dr. Kinase has been rigorously evaluated using independent testing, demonstrating excellent accuracy with area under the curve values exceeding 0.89 in different types of DR hotspot predictions. We further conducted in silico analyses to evaluate and validate the epidermal growth factor receptor mutations on protein conformation and KIs' binding efficacy. Dr. Kinase is freely available at http://modinfor.com/drkinase, with comprehensive annotations and visualizations. We anticipate that Dr. Kinase will be a highly useful service for the basic, translational, and clinical community to unveil the molecular mechanisms of DR and the development of next-generation KIs for emerging cancer precision medicine.",2025-05-01,10.1093/nar/gkaf366,2025/05/01
Structure of the complex of C1q-like 3 protein with adhesion-GPCR BAI3.,"The adhesion-GPCR Brain-specific Angiogenesis Inhibitor-3 (BAI3) plays a crucial role in organizing synapses in the brain. However, how BAI3 engages one of its ligands, the C1q-like proteins (C1qls), remains largely unexplored. Here, we present the single-particle cryo-electron microscopy (cryo-EM) structure of the C1ql3-BAI3 complex at 2.8 Å resolution. The structure reveals a hexameric configuration, where C1ql3 forms a central homotrimer that effectively captures three BAI3 molecules. These BAI3 molecules fit snugly into the grooves between the trimeric C1q domains of the C1qls, employing calcium ion (Ca<sup>2+</sup>)-mediated interactions that differ from previously characterized structures of C1q-like domain-mediated complexes. Furthermore, we conducted mutant analysis and cell surface staining, which confirmed the essential contact residues involved in this interaction. This unique binding mechanism not only enhances our understanding of the C1ql-BAI3-mediated synaptic organization but also sheds light on the functional dynamics of BAI3 in the brain.",2025-05-03,10.1038/s42003-025-08112-w,2025/05/02
Precise modulation of protein refolding by rationally designed covalent organic frameworks.,"Precisely regulating protein conformation (folding) for biomanufacturing and biomedicine is of great significance but remains challenging. In this work, we innovate a covalent organic framework (COF)-directed protein refolding strategy to modulate protein conformation by rationally designed covalent organic frameworks with adapted pore structures and customizable microenvironments. The conformation of denatured protein can be efficiently recovered through a simple one-step approach using covalent organic framework treatment in aqueous or buffer solutions. This strategy demonstrates high generality that can be applied to various proteins (for example, lysozyme, glucose oxidase, trypsin, nattokinase, and papain) and diverse covalent organic frameworks. An in-depth investigation of the refolding mechanism reveals that pore size and microenvironments such as hydrophobicity, π-π conjugation, and hydrogen bonding are critical to regulating protein conformation. Furthermore, we use this covalent organic framework platform to build up solid-phase columns for continuous protein recovery and achieved a ~ 100% refolding yield and excellent recycling performance (30 cycles), enabling an integrated process for the extracting and refolding denatured proteins (such as the harvest of protein in inclusion bodies). This study creates a highly efficient and customizable covalent organic framework platform for precisely regulating proteins refolding and enhancing their performance, opening up a new avenue for advanced protein manufacturing.",2025-05-03,10.1038/s41467-025-59368-z,2025/05/02
"Design, Synthesis, and Evaluation of a Novel Positron Emission Tomography Tracer Targeting Fibroblast Activation Protein: From Bench to Bedside.","FAPI-PET/CT has become a promising tool for cancer diagnosis. However, the pharmacokinetic properties of FAPI tracers need optimization. Here, we developed a novel FAPI tracer, [<sup>18</sup>F]AlF-NOTA-SP<sub>2</sub>A-FAPT, for cancer imaging. NOTA-SP<sub>2</sub>A-FAPT was successfully synthesized and radiolabeled with a high radiochemical purity. [<sup>18</sup>F]AlF-NOTA-SP<sub>2</sub>A-FAPT displayed satisfying stability, hydrophilicity, and affinity to FAP, as well as specific uptake in A549-FAP cells. Micro-PET/CT showed that [<sup>18</sup>F]AlF-NOTA-SP<sub>2</sub>A-FAPT is rapidly excreted through the renal system. [<sup>18</sup>F]AlF-NOTA-SP<sub>2</sub>A-FAPT exhibited high tumor uptake and excellent retention, showing better tumor delineation compared to [<sup>18</sup>F]FDG and [<sup>18</sup>F]AlF-NOTA-FAPI-42. Pilot clinical studies of [<sup>18</sup>F]AlF-NOTA-SP<sub>2</sub>A-FAPT and head-to-head comparison with [<sup>18</sup>F]FDG were performed on 13 cancer patients. Compared to [<sup>18</sup>F]FDG, [<sup>18</sup>F]AlF-NOTA-SP<sub>2</sub>A-FAPT had higher uptake in primary tumor and lymph node metastases as well as favorable distribution and good tumor retention. In conclusion, [<sup>18</sup>F]AlF-NOTA-SP<sub>2</sub>A-FAPT demonstrated high tumor accumulation, as well as improved pharmacokinetic properties. [<sup>18</sup>F]AlF-NOTA-SP<sub>2</sub>A-FAPT could emerge as a promising alternative to the currently established FAPI tracers.",2025-05-02,10.1021/acs.jmedchem.4c02961,2025/05/02
AdptDilatedGCN: Protein-ligand binding affinity prediction based on multi-scale interaction fusion mechanism and dilated GCN.,"Predicting protein-ligand binding affinity is crucial for drug discovery. However, existing prediction methods often make insufficient use of the features of proteins and ligands, lack interactions between different information, and have difficulty in capturing and integrating both fine- and coarse-grained information of proteins and ligands at the same time. Therefore, we propose a deep learning method called AdptDilatedGCN, which fully interacts with protein and ligand features through multi-scale interaction and fusion mechanism, mining potential fine-grained and coarsely grained information and fusing it, combining skip connections and multi-scale fusion strategy to improve feature utilization and enhance features. In the model, dilated Graph Convolutional Network(GCN) combines multi-head attention mechanism and dilated convolution to overcome the limitations of traditional GCN, while taking into account the interactions between amino acid nodes in the protein graph. In addition, an adaptive Gated Recurrent Unit(GRU) is designed to dynamically enhance the model's ability to integrate multi-source information in adaptive GCN. The Vina weights obtained from AutoDock Vina are used to supplement and further enhance the features learned from GCN. Finally, The model achieves Pearson correlation coefficients of 0.837 and 0.803 on the CASF-2016 and CASF-2013 public test sets, respectively.",2025-04-30,10.1016/j.ijbiomac.2025.143751,2025/05/02
Ribo-seq guided design of enhanced protein secretion in Komagataella phaffii.,"The production of recombinant proteins requires the precise coordination of various biological processes, including protein synthesis, folding, trafficking, and secretion. The overproduction of a heterologous protein can impose various bottlenecks on these networks. Identifying and alleviating these bottlenecks can guide strain engineering efforts to enhance protein production. The methylotrophic yeast Komagataella phaffii is used for its high capacity to produce recombinant proteins. Here, we use ribosome profiling to identify bottlenecks in protein secretion during heterologous expression of human serum albumin (HSA). Validation of this analysis showed that the knockout of non-essential genes whose gene products target the ER, through co- and post-translational mechanisms, and have high ribosome utilization can increase production of a heterologous protein, HSA. A triple knockout in co-translationally translocated carbohydrate and acetate transporter Gal2p, cell wall maintenance protein Ydr134cp, and the post-translationally translocated cell wall protein Aoa65896.1 increased HSA production by 35%. This data-driven strain engineering approach uses cell-level information to identify gene targets for phenotype improvement. This specific case identifies hits and creates strains with improved HSA production, with Ribo-seq and bioinformatic analysis to identify non-essential ER targeted proteins that are high ribosome utilizers.",2025-04-30,10.1016/j.ymben.2025.04.007,2025/05/02
PSTP: accurate residue-level phase separation prediction using protein conformational and language model embeddings.,"Phase separation (PS) is essential in cellular processes and disease mechanisms, highlighting the need for predictive algorithms to analyze uncharacterized sequences and accelerate experimental validation. Current high-accuracy methods often rely on extensive annotations or handcrafted features, limiting their generalizability to sequences lacking such annotations and making it difficult to identify key protein regions involved in PS. We introduce Phase Separation's Transfer-learning Prediction (PSTP), which combines conformational embeddings with large language model embeddings, enabling state-of-the-art PS predictions from protein sequences alone. PSTP performs well across various prediction scenarios and shows potential for predicting novel-designed artificial proteins. Additionally, PSTP provides residue-level predictions that are highly correlated with experimentally validated PS regions. By analyzing 160 000+ variants, PSTP characterizes the strong link between the incidence of pathogenic variants and residue-level PS propensities in unconserved intrinsically disordered regions, offering insights into underexplored mutation effects. PSTP's sliding-window optimization reduces its memory usage to a few hundred megabytes, facilitating rapid execution on typical CPUs and GPUs. Offered via both a web server and an installable Python package, PSTP provides a versatile tool for decoding protein PS behavior and supporting disease-focused research.",2025-05-03,10.1093/bib/bbaf171,2025/05/02
A rationally designed injury kidney targeting peptide library and its application in rescuing acute kidney injury.,"Acute kidney injury (AKI) has high incidence and mortality rates. Present treatments are mostly symptomatic and cause side effects due to systemic distribution; thus, targeted kidney drug delivery is desired. Transmembrane kidney injury molecule-1 (KIM1) is expressed at low levels in normal kidneys but markedly up-regulated following injury, making it an ideal marker/target for injured kidneys. Here, assisted by AlphaFold, we constructed a library of 1885 peptides that target the extracellular Ig V domain of KIM1 based on interacting fragments from 47 potential KIM1 binding proteins followed by systemic optimization according to their binding energies with KIM1. Experimental validation of top candidates (TKP 1-5) demonstrated that TKP 4 efficiently targeted injured renal cells/kidneys, with its specificity demonstrated in KIM1 knockout cells/mice. TKP 4-decorating liposomes were loaded with nystatin, a renal-protective compound with systemic side effects, and efficiently targeted injured mouse kidneys and alleviated AKI. This work establishes a virtual platform to screen/identify drug delivery candidates with broad research/therapeutic potentials.",2025-05-02,10.1126/sciadv.adt3943,2025/05/02
Enhancing privacy in biosecurity with watermarked protein design.,The biosecurity issue arises as the capability of deep learning-based protein design has rapidly increased in recent years. Current regulation procedures for DNA synthesizing focus on the biosecurity but ignore the data privacy.,2025-05-02,10.1093/bioinformatics/btaf141,2025/05/02
